"Freier L.F., Holloway K.",36542421000;57205398036;,The Impact of Tourist Visas on Intercontinental South-South Migration: Ecuador’s Policy of “Open Doors” as a Quasi-Experiment,2019,International Migration Review,53,4,,1171,1208,,13,10.1177/0197918318801068,https://www.scopus.com/inward/record.uri?eid=2-s2.0-85059900710&doi=10.1177%2f0197918318801068&partnerID=40&md5=60533a0c145229926d2e61b312680c19,"Universidad del Pacífico, Lima, Peru; Innovations for Poverty Action (IPA), United States","Freier, L.F., Universidad del Pacífico, Lima, Peru; Holloway, K., Innovations for Poverty Action (IPA), United States","Through the implementation of universal visa freedom from 2008 to 2010, Ecuador became one of the most accessible countries in the world. This article employs mixed methods to study the impact of the de facto opening of Ecuador’s borders on intercontinental south-south migration. First, we use a difference-in-difference design to show that Ecuador’s policy of universal visa freedom led to a significant increase of immigration from previously restricted nationalities in Africa, Asia, and the Caribbean. Complementary descriptive statistics and qualitative findings confirm the decisive impact visa freedom had on intercontinental south-south migration and suggest three main motives: taking advantage of Ecuador’s open doors as an exit option from origin countries, settlement in Ecuador based on relatively improved opportunities, and transmigration to third countries. Our findings imply that travel visa policies of southern countries significantly impact which new south-south flows emerge. © The Author(s) 2018.",,immigrant; immigration policy; international migration; policy implementation; tourist destination; Ecuador,"Freier, L.F.; Universidad del PacíficoPeru; email: lf.freierd@up.edu.pe",,SAGE Publications Ltd,1979183,,,,English,Int. Migr. Rev.,Article,Final,,Scopus,2-s2.0-85059900710
"Freier L.F., Parent N.",36542421000;57200006481;,The regional response to the Venezuelan exodus,2019,Current History,118,,,56,61,,25,,https://www.scopus.com/inward/record.uri?eid=2-s2.0-85061477527&partnerID=40&md5=086a0cf56180422a327f4cf41b466f14,"Universidad del Pacífico in Lima, Peru, United States","Freier, L.F., Universidad del Pacífico in Lima, Peru, United States; Parent, N., Universidad del Pacífico in Lima, Peru, United States",[No abstract available],,,,,Current History Inc.,113530,,,,English,Curr. Hist.,Review,Final,,Scopus,2-s2.0-85061477527
"Freier L.F., Álvarez A.C., Arón V.",36542421000;57210892464;57210885303;,The suffering of the migrant: Cuban migration and the ecuadorian dream of free human mobility [El sufrimiento del migrante: la migración cubana en el sueño ecuatoriano de la libre movilidad],2019,Apuntes,46,84,,83,110,,2,10.21678/apuntes.84.1009,https://www.scopus.com/inward/record.uri?eid=2-s2.0-85071774387&doi=10.21678%2fapuntes.84.1009&partnerID=40&md5=9f1668c267308960edaf4db9abef1757,"Universidad del Pacífico, Lima, Peru; University of California, Merced, United States","Freier, L.F., Universidad del Pacífico, Lima, Peru; Álvarez, A.C., University of California, Merced, United States; Arón, V., Universidad del Pacífico, Lima, Peru","This paper explores the tension between the concept of suffering as employed in Rafael Correa’s humanist migration discourse and the migratory experience of Cuban immigrants in Ecuador. Despite the former president’s revolutionary discourse, Cuban migrants face triple discrimination: social, economic and legal, in the context of both Ecuadorian and Cuban migration policies. This study contributes to the literature on migration and suffering, as well as the emerging literature on the discursive gaps inherent in Latin American immigration policy liberalization. © Creative Commons Attribution 3.0.",Cuba; Ecuador; Migration; Migration policy; South-south migration; Suffering,,,,Universidad del Pacífico Press,2521865,,,,English; Spanish,Apuntes,Article,Final,"All Open Access, Gold, Green",Scopus,2-s2.0-85071774387
"Acosta D., Freier L.F.",55824145200;36542421000;,Regional governance of migration in South America,2018,Handbook of Migration and Globalisation,,,,69,85,,11,10.4337/9781785367519.00011,https://www.scopus.com/inward/record.uri?eid=2-s2.0-85047930454&doi=10.4337%2f9781785367519.00011&partnerID=40&md5=9011f816291ef07a5ea880cd8eed17e3,"University of Bristol, United Kingdom; Universidad del Pacífico, Peru","Acosta, D., University of Bristol, United Kingdom; Freier, L.F., Universidad del Pacífico, Peru",[No abstract available],,,"Acosta, D.; University of BristolUnited Kingdom",,Edward Elgar Publishing Ltd.,,9781785367519; 9781785367502,,,English,Handb. of Migr. and Glob.,Book Chapter,Final,,Scopus,2-s2.0-85047930454
"Acosta Arcarazo D., Freier L.F.",55824145200;36542421000;,Turning the Immigration Policy Paradox Upside Down? Populist Liberalism and Discursive Gaps in South America,2015,International Migration Review,49,3,,659,696,,67,10.1111/imre.12146,https://www.scopus.com/inward/record.uri?eid=2-s2.0-84941942172&doi=10.1111%2fimre.12146&partnerID=40&md5=0db9c851be5b46799560effce61579f7,"University of Bristol, United Kingdom; London School of Economics and Political Science, Universidad Del Pacífico (Perú), United Kingdom","Acosta Arcarazo, D., University of Bristol, United Kingdom; Freier, L.F., London School of Economics and Political Science, Universidad Del Pacífico (Perú), United Kingdom","A paradox of officially rejecting but covertly accepting irregular migrants has long been identified in the immigration policies of Western immigrant receiving states. In South America, on the other hand, a liberal discourse of universally welcoming all immigrants, irrespective of their origin and migratory status, has replaced the formally restrictive, securitized and not seldomly ethnically selective immigration rhetoric. This discursive liberalization has found partial translation into immigration laws and policies, but contrary to the universality of rights claimed in their discourses, governments reject recently increasing irregular south-south migration from Africa, Asia, and the Caribbean to varying degrees. This paper applies a mixed methodological approach of discourse and legal analysis and process tracing to explore in how far recent immigration policies in South America constitute a liberal turn, or rather a reverse immigration policy paradox of officially welcoming but covertly rejecting irregular migrants. Based on the comparative analysis of Argentina, Brazil and Ecuador, the study identifies and explains South American ""populist liberalism"" in the sphere of migration. We highlight important implications for migration theory, thereby opening up new avenues of research on immigration policy making outside Western liberal democracies, and particularly in predominantly migrant sending countries. © 2015 by the Center for Migration Studies of New York. All rights reserved.",,African immigrant; Asian immigrant; comparative study; immigrant population; immigration policy; liberalism; policy analysis; population migration; populism; Argentina; Brazil; Ecuador; South America,,,Blackwell Publishing Inc.,1979183,,,,English,Int. Migr. Rev.,Review,Final,"All Open Access, Green",Scopus,2-s2.0-84941942172
Freier L.F.,36542421000;,A liberal paradigm shift? A critical appraisal of recent trends in latin American asylum legislation,2015,Exploring the Boundaries of Refugee Law: Current Protection Challenges,3,,,118,145,,13,10.1163/9789004265585_007,https://www.scopus.com/inward/record.uri?eid=2-s2.0-84937547167&doi=10.1163%2f9789004265585_007&partnerID=40&md5=3dbb737c48ee8ff2a91fd49590610915,"London School of Economics and Political Science, Department of Government, United Kingdom","Freier, L.F., London School of Economics and Political Science, Department of Government, United Kingdom",[No abstract available],,,"Freier, L.F.; London School of Economics and Political Science, Department of GovernmentUnited Kingdom",,Brill,,9789004265585; 9789004265578,,,English,Explor. the Boundaries of Refug. Law: Curr. Prot. Challenges,Book Chapter,Final,,Scopus,2-s2.0-84937547167
Freier L.F.,36542421000;,How Our Lady of Guadalupe became Lutheran: Latin American migration and religious change,2009,Migraciones Internacionales,5,2,,153,190,,7,,https://www.scopus.com/inward/record.uri?eid=2-s2.0-77950742612&partnerID=40&md5=4816a89c7fa7172c090d93626d50e99d,"Student M. A. Latin American, Caribbean and Iberian Studies, University of Wisconsin-Madison, United States","Freier, L.F., Student M. A. Latin American, Caribbean and Iberian Studies, University of Wisconsin-Madison, United States","International migration is initiating myriad processes of religious change from the level of individual conversion to the institutional transformation of religious structures and practices. An approach combining a transnational perspective and the concept of diaspora space facilitates the analysis of the different scales, agents, and actions involved in migration-caused religious change. The article analyzes the broadening of lutheranism to incorporate Latino Catholic culture into the Evangelical lutheran Church in America (ELCA) in madison, Wisconsin. Under the leadership of their pastor, latin American immigrants in madison are agents redefining the understanding of the category Lutheran through the incorporation of popular Catholicism. Though strongly contested by the Roman Catholic Church, the ELCA accepts these processes due to its institutional interest in the recruitment of new latino worshippers.",Latin american migration; Lutheranism (ELCA); Midwest; Religious change; Transnationalism,,"Freier, L. F.; Student M. A. Latin American, United States",,El Colegio de la Frontiera Norte,16658906,,,,English,Migraciones Int.,Article,Final,,Scopus,2-s2.0-77950742612
